{
  "schema_version": "omp.role-contract/v1",
  "contract_id": "role-contract/tiny/v1",
  "role": "tiny",
  "display_name": "Exact Metadata and Classification",
  "diagnostic_contract": "Small titles, memory operations, classifications, and metadata transformations that obey a narrow output contract exactly, remain deterministic, and consume minimal time and resources.",
  "required_capabilities": [
    "structured-output",
    "exact-format-following",
    "metadata-transformation",
    "classification",
    "minimal-output"
  ],
  "primary_metric": "exact-output-rate",
  "secondary_metrics": [
    "classification-accuracy",
    "format-validity",
    "end-to-end-latency",
    "token-consumption"
  ],
  "verifier": {
    "objective_required": true,
    "modes": [
      "exact-match-check",
      "schema-conformance-check",
      "classification-label-check"
    ],
    "llm_judge": "disallowed"
  },
  "failure_cost": "low",
  "stickiness_scope": "operation",
  "task_mix": "tiny-v1",
  "thresholds": {
    "status": "calibration-required",
    "quality_floor": null,
    "reliability_floor": null,
    "confidence": null,
    "latency_slo_seconds": null
  }
}
