{
  "schema_version": "omp.role-contract/v1",
  "contract_id": "role-contract/vision/v1",
  "role": "vision",
  "display_name": "Image-Grounded Multimodal Work",
  "diagnostic_contract": "Image-grounded multimodal work that accepts required visual inputs, extracts relevant observable evidence, and produces conclusions or changes traceable to that evidence without fabricating unseen details.",
  "required_capabilities": [
    "image-input",
    "visual-evidence-grounding",
    "multimodal-reasoning",
    "spatial-understanding",
    "text-in-image-reading"
  ],
  "primary_metric": "visual-grounding-accuracy",
  "secondary_metrics": [
    "required-input-support",
    "evidence-recall",
    "unsupported-claim-rate",
    "task-completion-rate"
  ],
  "verifier": {
    "objective_required": true,
    "modes": [
      "visual-evidence-check",
      "reference-annotation-check",
      "multimodal-artifact-review"
    ],
    "llm_judge": "supplemental"
  },
  "failure_cost": "high",
  "stickiness_scope": "operation",
  "task_mix": "vision-v1",
  "thresholds": {
    "status": "calibration-required",
    "quality_floor": null,
    "reliability_floor": null,
    "confidence": null,
    "latency_slo_seconds": null
  }
}
