{
  "schema_version": "omp.role-contract/v1",
  "contract_id": "role-contract/task/v1",
  "role": "task",
  "display_name": "Autonomous Delegated Implementation",
  "diagnostic_contract": "Self-contained delegated implementation completed autonomously from repository inspection through safe edits and targeted verification, while honoring scope and returning a usable result to the parent workflow.",
  "required_capabilities": [
    "autonomous-task-execution",
    "terminal-tool-use",
    "code-editing",
    "repository-navigation",
    "targeted-verification"
  ],
  "primary_metric": "autonomous-completion-rate",
  "secondary_metrics": [
    "accepted-solve-rate",
    "scope-adherence",
    "verification-validity",
    "regression-avoidance"
  ],
  "verifier": {
    "objective_required": true,
    "modes": [
      "executable-task-verifier",
      "artifact-diff-review",
      "acceptance-criteria-check"
    ],
    "llm_judge": "supplemental"
  },
  "failure_cost": "high",
  "stickiness_scope": "child-session",
  "task_mix": "task-v1",
  "thresholds": {
    "status": "calibration-required",
    "quality_floor": null,
    "reliability_floor": null,
    "confidence": null,
    "latency_slo_seconds": null
  }
}
